commit	phase	score	word_count	status	description
6e59bbd	foundation	8.0	0	keep	迭代 1: 评分提升 0.0 -> 8.0
764857e	ch01	9.2	3409	keep	第 1 章 (尝试 1)
9a66b2c	ch02	6.0	3432	keep	第 2 章 (尝试 1)
5a6d96f	ch03	9.0	4924	keep	第 3 章 (尝试 1)
05cbff2	revision-cycle-1	7.0	11765	cycle	循环 1: novel_score 0.0->7.0
e60ba2f	revision-cycle-2	7.0	11765	cycle	循环 2: novel_score 7.0->7.0
72dc227	revision-cycle-3	8.0	11765	cycle	循环 3: novel_score 7.0->8.0
602d57d	revision-cycle-4	7.0	11765	cycle	循环 4: novel_score 8.0->7.0
5383985	revision-cycle-5	7.0	11765	cycle	循环 5: novel_score 7.0->7.0
discarded	foundation	-1.0	0	discard	迭代 20: 未提升 (-1.0 <= 0.0)
0cedc9a	foundation	9.0	0	keep	迭代 1: 评分提升 0.0 -> 9.0
d75b963	ch01	9.5	1925	keep	第 1 章 (尝试 1)
901c935	ch02	10.0	1863	keep	第 2 章 (尝试 1)
4ff9b61	ch03	9.0	1606	keep	第 3 章 (尝试 1)
ee98221	revision-cycle-1	8.2	5394	cycle	循环 1: novel_score 0.0->8.2
6ad7c28	revision-cycle-2	9.0	5394	cycle	循环 2: novel_score 8.2->9.0
669fba3	revision-cycle-3	8.2	5394	cycle	循环 3: novel_score 9.0->8.2
b86e888	revision-cycle-4	8.6	5394	cycle	循环 4: novel_score 8.2->8.6
08ee37d	revision-cycle-5	9.0	5394	cycle	循环 5: novel_score 8.6->9.0
def12ad	revision-cycle-6	7.6	5394	cycle	循环 6: novel_score 9.0->7.6
7803b86	export	7.6	5394	export	最终导出
88ad76f	foundation	8.8	0	keep	迭代 1: 评分提升 0.0 -> 8.8
743ed07	ch01	9.2	3770	keep	第 1 章 (尝试 1)
d44069b	revision-cycle-1	6.0	3770	cycle	循环 1: novel_score 0.0->6.0
b250efc	revision-cycle-2	7.0	3770	cycle	循环 2: novel_score 6.0->7.0
fe6e811	revision-cycle-3	7.0	3770	cycle	循环 3: novel_score 7.0->7.0
80b7285	export	7.0	3770	export	最终导出
a72a9bd	foundation	10.0	0	keep	迭代 1: 评分提升 0.0 -> 10.0
e3dc605	ch01	9.0	2804	keep	第 1 章 (尝试 1)
dc6db58	revision-cycle-1	8.5	2804	cycle	循环 1: novel_score 0.0->8.5
b38b68a	foundation	10.0	0	keep	迭代 1: 评分提升 0.0 -> 10.0
ae735d4	ch01	8.0	3222	keep	第 1 章 (尝试 1)
3e804c4	revision-cycle-1	7.0	3222	cycle	循环 1: novel_score 0.0->7.0
6c53c94	revision-cycle-2	5.0	3222	cycle	循环 2: novel_score 7.0->5.0
dbd3519	revision-cycle-3	7.2	3222	cycle	循环 3: novel_score 5.0->7.2
418de75	revision-cycle-4	7.8	3222	cycle	循环 4: novel_score 7.2->7.8
eb7a848	foundation	9.0	0	keep	迭代 1: 评分提升 0.0 -> 9.0
27c1a00	ch01	9.6	2597	keep	第 1 章 (尝试 1)
7aa9b84	revision-cycle-1	7.8	2597	cycle	循环 1: novel_score 0.0->7.8
595936a	revision-cycle-2	7.0	2597	cycle	循环 2: novel_score 7.8->7.0
be69b61	export	7.0	2597	export	最终导出
997a1ca	foundation	10.0	0	keep	迭代 1: 评分提升 0.0 -> 10.0
59c7568	ch01	10.0	2420	keep	第 1 章 (尝试 1)
0f4761b	revision-cycle-1	6.5	2420	cycle	循环 1: novel_score 0.0->6.5
5167f63	revision-cycle-2	7.0	2420	cycle	循环 2: novel_score 6.5->7.0
7e38f0a	export	7.0	2420	export	最终导出
7d68f68	foundation	9.0	0	keep	迭代 1: 评分提升 0.0 -> 9.0
cd2285b	ch01	8.0	4469	keep	第 1 章 (尝试 1)
dff7ca0	revision-cycle-1	8.0	4469	cycle	循环 1: novel_score 0.0->8.0
034a7c3	revision-cycle-2	7.6	4469	cycle	循环 2: novel_score 8.0->7.6
2546395	export	7.6	4469	export	最终导出
efc8f53	foundation	9.0	0	keep	迭代 1: 评分提升 0.0 -> 9.0
8df5cb9	ch02	9.0	3242	keep	第 2 章 (尝试 1)
439d971	revision-cycle-1	8.0	3278	cycle	循环 1: novel_score 0.0->8.0
f680f05	revision-cycle-2	8.0	3278	cycle	循环 2: novel_score 8.0->8.0
4d831a9	export	8.0	3278	export	最终导出
reverted	review-rev-ch03	-1.0	4822	discard	审阅修订 轮次3: ch03 倒退 6.8->-1.0
4d29dcd	review-rev-ch04	7.0	8959	keep	审阅修订 轮次3: ch04 7.0->7.0
554b018	review-rev-ch01	7.2	2946	keep	审阅修订 轮次3: ch01 0->7.2
1ceb090	review-revision-round-3	0	22551	cycle	审阅修订 轮次3: 修订 4 章
bb8c7be	export	6.5	22551	export	最终导出
f5b4b73	export	6.5	22551	export	最终导出
reverted	review-rev-ch01	6.0	4436	discard	审阅修订 轮次3: ch01 倒退 6.5->6.0
6df2641	export	5.5	14542	export	最终导出
reverted	review-rev-ch01	8.0	3700	discard	审阅修订 轮次3: ch01 倒退 9.0->8.0
1435f3f	review-revision-round-3	0	12075	cycle	审阅修订 轮次3: 修订 3 章
4a35180	export	7.0	12075	export	最终导出
reverted	review-rev-ch01	7.3	4683	discard	审阅修订 轮次3: ch01 倒退 8.0->7.3
effa692	review-revision-round-3	0	11767	cycle	审阅修订 轮次3: 修订 4 章
7bae829	export	6.1	11767	export	最终导出
reverted	rev-ch03	6.2	6872	discard	循环 3: 共识问题 倒退 8.0->6.2
05838c1	revision-cycle-3	7.0	13988	cycle	循环 3: novel_score 6.2->7.0
03e620c	export	7.0	13988	export	最终导出
reverted	rev-ch57	4.5	3392	discard	循环 2: cut_candidate 倒退 6.0->4.5
	rev-ch30	5.0	5607	keep	循环 2: momentum_loss 改进 4.7->5.0
	revision-cycle-2	5.0	348876	cycle	循环 2: novel_score 4.5->5.0
	export	5.0	349280	export	最终导出
reverted	rev-ch05	6.0	1595	discard	循环 2: momentum_loss 倒退 6.5->6.0
059fd9d	rev-ch08	7.0	3987	keep	循环 2: worst_scene 改进 6.5->7.0
e4a80d0	rev-ch06	7.0	2208	keep	循环 2: momentum_loss 改进 6.8->7.0
91ef074	rev-ch07	7.0	4122	keep	循环 2: momentum_loss 改进 6.5->7.0
99330e0	rev-ch01	7.0	3199	keep	循环 2: momentum_loss 改进 7.0->7.0
4e0e070	revision-cycle-2	6.0	30737	cycle	循环 2: novel_score 5.5->6.0
4c49a3e	export	6.0	32151	export	最终导出
